Menaces envisageables,Risques à considérer,Contres mesures
Dump mémoire STM32 et Raspberry,✓,Hasher la clef / Composant de sécurité pour le firmware et clef
"Canaux cachés   (DPA, SPA)",⨯,
Autre Noeud usurpant l'identité de notre Noeud (altération des données),✓,Signature et certificat
Mise à jour venant d'une entité autre que le serveur de mise à jour officiel,✓,Signature des MAJ / certificat
Interception des mises à jour,✓,VPN
Execution d'un OS malicieux sur la box LoRA,✓,Secure boot
Modification du programme du noeud,✓,Condamnation des GPIO de debogage
DoS attaque par envoi massif de données sur la Box LoRa,✓,Limiter la réception d'un nombre de trames par X temps
